{
  "run": "mainecybertech-20261004-0700-main-178b91c",
  "generated": "2026-10-05T01:35:56Z",
  "sourceReports": 1,
  "counts": {
    "bySeverity": {
      "P2": 7,
      "P3": 7
    },
    "byArea": {
      "CI": 6,
      "CONF": 2,
      "PORT": 1,
      "SEC": 3,
      "SUPPLY": 2
    },
    "total": 14
  },
  "findings": [
    {
      "id": "CI-P2-001",
      "severity": "P2",
      "title": "World-open DigitalOcean firewall mutation with no approval and unvalidated udp_port",
      "report": "lens_focused_security_supply_chain_ci.md",
      "line": 7,
      "owner": "@owner",
      "target": "CI",
      "status": "verified-fixed",
      "note": ""
    },
    {
      "id": "CI-P2-002",
      "severity": "P2",
      "title": "Deploy-gate secret scan is a no-op on pushes to main",
      "report": "lens_focused_security_supply_chain_ci.md",
      "line": 8,
      "owner": "@owner",
      "target": "CI",
      "status": "verified-fixed",
      "note": ""
    },
    {
      "id": "CI-P2-003",
      "severity": "P2",
      "title": "Production approval environment documented as having no required reviewers",
      "report": "lens_focused_security_supply_chain_ci.md",
      "line": 9,
      "owner": "@owner",
      "target": "CI",
      "status": "verified-fixed",
      "note": ""
    },
    {
      "id": "CONF-P2-001",
      "severity": "P2",
      "title": "Workflow-scope PAT SCHEDULE_DISPATCH_TOKEN omitted from secret inventory and rotation policy",
      "report": "lens_focused_security_supply_chain_ci.md",
      "line": 13,
      "owner": "@owner",
      "target": "CONF",
      "status": "verified-fixed",
      "note": ""
    },
    {
      "id": "PORT-P2-001",
      "severity": "P2",
      "title": "17 tracked shell scripts lack the exec bit; documented ./scripts/... commands fail",
      "report": "lens_focused_security_supply_chain_ci.md",
      "line": 10,
      "owner": "@owner",
      "target": "PORT",
      "status": "verified-fixed",
      "note": ""
    },
    {
      "id": "SEC-P2-001",
      "severity": "P2",
      "title": "Secret scanner echoes the matched secret value into CI logs",
      "report": "lens_focused_security_supply_chain_ci.md",
      "line": 11,
      "owner": "@owner",
      "target": "SEC",
      "status": "verified-fixed",
      "note": ""
    },
    {
      "id": "SEC-P2-002",
      "severity": "P2",
      "title": "Webhook SSRF guard has a DNS-rebinding TOCTOU window",
      "report": "lens_focused_security_supply_chain_ci.md",
      "line": 12,
      "owner": "@owner",
      "target": "SEC",
      "status": "verified-fixed",
      "note": ""
    },
    {
      "id": "CI-P3-001",
      "severity": "P3",
      "title": "actionlint/shellcheck workflow lint issues (SC2086/SC2129/SC2002/SC2015)",
      "report": "lens_focused_security_supply_chain_ci.md",
      "line": 14,
      "owner": "@owner",
      "target": "CI",
      "status": "verified-fixed",
      "note": ""
    },
    {
      "id": "CI-P3-002",
      "severity": "P3",
      "title": "Over-broad workflow token permissions (unused write scopes)",
      "report": "lens_focused_security_supply_chain_ci.md",
      "line": 15,
      "owner": "@owner",
      "target": "CI",
      "status": "verified-fixed",
      "note": ""
    },
    {
      "id": "CI-P3-003",
      "severity": "P3",
      "title": "StrictHostKeyChecking=no in the deploy health check",
      "report": "lens_focused_security_supply_chain_ci.md",
      "line": 16,
      "owner": "@owner",
      "target": "CI",
      "status": "verified-fixed",
      "note": ""
    },
    {
      "id": "CONF-P3-001",
      "severity": "P3",
      "title": "Secret rotation policy has no evidence any secret was ever rotated",
      "report": "lens_focused_security_supply_chain_ci.md",
      "line": 20,
      "owner": "@owner",
      "target": "CONF",
      "status": "open",
      "note": ""
    },
    {
      "id": "SEC-P3-001",
      "severity": "P3",
      "title": "gitleaks generic-api-key/jwt hits are false positives (no tracked secret)",
      "report": "lens_focused_security_supply_chain_ci.md",
      "line": 17,
      "owner": "@owner",
      "target": "SEC",
      "status": "verified-fixed",
      "note": ""
    },
    {
      "id": "SUPPLY-P3-001",
      "severity": "P3",
      "title": "Unpinned container images (test/local only); production app images tag-based by design",
      "report": "lens_focused_security_supply_chain_ci.md",
      "line": 18,
      "owner": "@owner",
      "target": "SUPPLY",
      "status": "verified-fixed",
      "note": ""
    },
    {
      "id": "SUPPLY-P3-002",
      "severity": "P3",
      "title": "Dockerfile lint: missing WORKDIR in web runner stage and shell-form HEALTHCHECK",
      "report": "lens_focused_security_supply_chain_ci.md",
      "line": 19,
      "owner": "@owner",
      "target": "SUPPLY",
      "status": "verified-fixed",
      "note": ""
    }
  ]
}
