{
  "run": "falcon-20261004-fast-main-f9cb67d",
  "generated": "2026-10-05T03:29:03Z",
  "sourceReports": 3,
  "counts": {
    "bySeverity": {
      "P2": 6,
      "P3": 7
    },
    "byArea": {
      "CI": 2,
      "DET": 4,
      "SC": 5,
      "SEC": 2
    },
    "total": 13
  },
  "findings": [
    {
      "id": "CI-P2-001",
      "severity": "P2",
      "title": "Branch protection and required checks are plan-gated, so `validate` is advisory",
      "report": "10_github_actions_cicd_governance.md",
      "line": 21,
      "owner": "@owner",
      "target": "CI",
      "status": "owner-accepted",
      "note": "Owner-accepted with compensating controls (CODEOWNERS, PR template, doctrine). Carried from focused run CI-P2-001 / 20261003 CI-P1-002.",
      "area": "CI",
      "recommendation": "Owner decision D: upgrade to GitHub Pro/Team and apply the recorded payload, or per-merge attest that validate was green and treat direct pushes as break-glass."
    },
    {
      "id": "CI-P2-002",
      "severity": "P2",
      "title": "Auto-merge workflow holds broad write scope and merges without pinning the checked commit",
      "report": "10_github_actions_cicd_governance.md",
      "line": 22,
      "owner": "@ci",
      "target": "CI",
      "status": "open",
      "note": "Carried from focused run CI-P3-001 / 20261003 CI-P2-002; still present at f9cb67d.",
      "area": "CI",
      "recommendation": "Add `--match-head-commit` to `gh pr merge`, scope permissions to the minimum, and add an environment/required-review gate to the auto-merge job."
    },
    {
      "id": "SC-P2-001",
      "severity": "P2",
      "title": "Dependabot covers only GitHub Actions; Python CI deps and container images are unmanaged",
      "report": "11_supply_chain_dependency_secrets.md",
      "line": 21,
      "owner": "@supply",
      "target": "SC",
      "status": "open",
      "note": "Carried from focused run DEP-P2-001; still present at f9cb67d.",
      "area": "SC",
      "recommendation": "Add pip/uv and docker ecosystems to `.github/dependabot.yml`, or add `renovate.json` with digest pinning, preserving the hash-pin policy for CI deps."
    },
    {
      "id": "SC-P2-002",
      "severity": "P2",
      "title": "Release and SBOM artifacts are integrity-checked but unsigned (SLSA ~0-1)",
      "report": "11_supply_chain_dependency_secrets.md",
      "line": 22,
      "owner": "@supply",
      "target": "SC",
      "status": "open",
      "note": "Carried from focused run SUPPLY-P2-001; still present at f9cb67d.",
      "area": "SC",
      "recommendation": "Implement D1: an owner-held ed25519/GPG signature over `sbom/SBOM_MANIFEST.sha256` with the public key published and the manifest hash bound in `PACKAGE_DIGEST.txt`, or use GitHub artifact attestations."
    },
    {
      "id": "SEC-P2-001",
      "severity": "P2",
      "title": "Public-facing routers rely only on Cloudflare Access; `ntfy-auth` is dead config",
      "report": "06_security_authz_tenancy_audit.md",
      "line": 21,
      "owner": "@security",
      "target": "SEC",
      "status": "open",
      "note": "Carried from focused run SEC-P2-001; not yet fixed at f9cb67d.",
      "area": "SEC",
      "recommendation": "Add origin authentication to public routers (or record a testable owner acceptance); delete or wire `ntfy-auth`."
    },
    {
      "id": "SEC-P2-002",
      "severity": "P2",
      "title": "All 20 inherited credentials remain PENDING rotation; 28 vendored scripts source credential files wholesale",
      "report": "06_security_authz_tenancy_audit.md",
      "line": 22,
      "owner": "@security",
      "target": "SEC",
      "status": "open",
      "note": "Tooling (rotation_status.py) added earlier; rotation execution itself remains outstanding.",
      "area": "SEC",
      "recommendation": "Execute the documented rotation order with name-only evidence and negative tests; migrate the 28 scripts to single-key reads."
    },
    {
      "id": "DET-P3-001",
      "severity": "P3",
      "title": "[DEP] trivy not installed (dependency vuln scan skipped)",
      "report": "lens_deterministic.md",
      "line": 16,
      "owner": "@owner",
      "target": "DET",
      "status": "open",
      "note": "",
      "area": "DET",
      "detail": "Install trivy to enable the --deep dependency vulnerability scan."
    },
    {
      "id": "DET-P3-002",
      "severity": "P3",
      "title": "[GIT] No LICENSE file",
      "report": "lens_deterministic.md",
      "line": 21,
      "owner": "@owner",
      "target": "DET",
      "status": "open",
      "note": "",
      "area": "DET",
      "detail": "Add a license."
    },
    {
      "id": "DET-P3-003",
      "severity": "P3",
      "title": "[SUPPLY] 58 container image(s) without a digest pin",
      "report": "lens_deterministic.md",
      "line": 26,
      "owner": "@owner",
      "target": "DET",
      "status": "open",
      "note": "",
      "area": "DET",
      "detail": "Pin images by digest (`image@sha256:...`) for reproducible, tamper-evident deploys."
    },
    {
      "id": "DET-P3-004",
      "severity": "P3",
      "title": "[SUPPLY] hadolint not installed (Dockerfile lint skipped)",
      "report": "lens_deterministic.md",
      "line": 41,
      "owner": "@owner",
      "target": "DET",
      "status": "open",
      "note": "",
      "area": "DET",
      "detail": "Install hadolint to lint Dockerfiles in --deep mode."
    },
    {
      "id": "SC-P3-001",
      "severity": "P3",
      "title": "Vendored mct/compose images are unpinned under a blanket waiver",
      "report": "11_supply_chain_dependency_secrets.md",
      "line": 23,
      "owner": "@supply",
      "target": "SC",
      "status": "open",
      "note": "Carried from focused run SUPPLY-P3-001 / DET-P3-007; still present at f9cb67d.",
      "area": "SC",
      "recommendation": "Scope the waiver to specific refs, add an explicit deploy-blocking guard for mct/compose, and remove or justify the docker.sock mounts."
    },
    {
      "id": "SC-P3-002",
      "severity": "P3",
      "title": "Vulnerability scan coverage for 12 images is stale/pending, gated only by expiring waivers",
      "report": "11_supply_chain_dependency_secrets.md",
      "line": 24,
      "owner": "@supply",
      "target": "SC",
      "status": "open",
      "note": "Carried from focused run SUPPLY-P3-002; still present at f9cb67d.",
      "area": "SC",
      "recommendation": "Run `automation/validation/vuln-summary.sh` in the next patch window, refresh waivers to real dispositions, and add a scheduled scan job."
    },
    {
      "id": "SC-P3-003",
      "severity": "P3",
      "title": "Image/SBOM-component license allow/deny gate is not enforced",
      "report": "11_supply_chain_dependency_secrets.md",
      "line": 25,
      "owner": "@supply",
      "target": "SC",
      "status": "open",
      "note": "Carried from focused run SUPPLY-P3-003; still present at f9cb67d.",
      "area": "SC",
      "recommendation": "Add `pins/licenses.allow` plus a check over `sbom/*.cdx.json` license fields (allow MIT/BSD/Apache/ISC; deny GPL/AGPL/LGPL/SSPL unless the self-hosted exception applies)."
    }
  ]
}
