{
  "run": "bench-test-20261007-1731-main-4ecee97",
  "generated": "2026-10-09T16:41:31Z",
  "sourceReports": 2,
  "counts": {
    "bySeverity": {
      "P1": 1,
      "P2": 4,
      "P3": 4
    },
    "byArea": {
      "CI": 1,
      "DATA": 1,
      "DET": 2,
      "GOV": 1,
      "SAFE": 1,
      "SUPPLY": 3
    },
    "total": 9
  },
  "findings": [
    {
      "id": "SUPPLY-P1-001",
      "severity": "P1",
      "title": "Get-Sensors.ps1 downloads the mutable 'latest' LibreHardwareMonitor release and loads it in-process without integrity verification",
      "report": "lens_focused_security_supply_chain_ci.md",
      "line": 7,
      "owner": "@owner",
      "target": "SUPPLY",
      "status": "open",
      "note": ""
    },
    {
      "id": "DATA-P2-001",
      "severity": "P2",
      "title": "Collectors capture stable hardware identifiers and PII with no redaction option, and the workflow encourages sharing results",
      "report": "lens_focused_security_supply_chain_ci.md",
      "line": 10,
      "owner": "@owner",
      "target": "DATA",
      "status": "open",
      "note": ""
    },
    {
      "id": "SAFE-P2-001",
      "severity": "P2",
      "title": "Default battery runs host-impacting phases without opt-in, and the wrapper defeats the VRAM-fill confirmation",
      "report": "lens_focused_security_supply_chain_ci.md",
      "line": 11,
      "owner": "@owner",
      "target": "SAFE",
      "status": "open",
      "note": ""
    },
    {
      "id": "SUPPLY-P2-001",
      "severity": "P2",
      "title": "Install-GpuFanCurve.ps1 downloads nvfancontrol with no checksum and runs it from an elevated logon task",
      "report": "lens_focused_security_supply_chain_ci.md",
      "line": 8,
      "owner": "@owner",
      "target": "SUPPLY",
      "status": "open",
      "note": ""
    },
    {
      "id": "SUPPLY-P2-002",
      "severity": "P2",
      "title": "PyTorch/numpy are installed at runtime from an unpinned, caller-controlled package index",
      "report": "lens_focused_security_supply_chain_ci.md",
      "line": 9,
      "owner": "@owner",
      "target": "SUPPLY",
      "status": "open",
      "note": ""
    },
    {
      "id": "CI-P3-001",
      "severity": "P3",
      "title": "No CI, dependency automation, or secret scanning in the repository",
      "report": "lens_focused_security_supply_chain_ci.md",
      "line": 12,
      "owner": "@owner",
      "target": "CI",
      "status": "open",
      "note": ""
    },
    {
      "id": "DET-P3-001",
      "severity": "P3",
      "title": "[CI] No GitHub Actions workflows",
      "report": "lens_deterministic.md",
      "line": 14,
      "owner": "@owner",
      "target": "CI",
      "status": "open",
      "note": ""
    },
    {
      "id": "DET-P3-002",
      "severity": "P3",
      "title": "[PORT] .gitattributes missing (no line-ending policy)",
      "report": "lens_deterministic.md",
      "line": 18,
      "owner": "@owner",
      "target": "PORT",
      "status": "open",
      "note": ""
    },
    {
      "id": "GOV-P3-001",
      "severity": "P3",
      "title": "Repository is public while LICENSE declares the material PROPRIETARY AND CONFIDENTIAL",
      "report": "lens_focused_security_supply_chain_ci.md",
      "line": 13,
      "owner": "@owner",
      "target": "GOV",
      "status": "open",
      "note": ""
    }
  ]
}
